{"commitDigest":"sha256-49495bd232a6db0dacd6989020bdb3cee16a33fc832edba008d0b585c3e5ef1c","graph":{"bindings":[{"authority":80,"evidenceId":"sha256-7de35ff8030c05ebcdd4892b024b68253cf1d6e563ca242fdf7c360d6d119869","id":"sha256-12d4757191daa594db0c4537b5a474cd4cbd17578adb36497ca7a6132c403284","nodeId":"sha256-b9f0b8007745e0df7f8e722e06d64364ae01800367a71c8604deeae48e5e7b0a","requirements":["cancel-barred"],"validFrom":"2026-01-01"},{"authority":40,"evidenceId":"sha256-0410b9c02eb7fe64b97194cadc3b81f79e7df2ea1d067116e436f69197bc189f","id":"sha256-b8ac99802e0d88f69650e75f6599a7b411c8ac4b4cceea4279007d609f4d2e9a","nodeId":"sha256-b9f0b8007745e0df7f8e722e06d64364ae01800367a71c8604deeae48e5e7b0a","requirements":["cancel-allowed"]}],"knowledgeRoot":"sha256-aa00ef9317cb8911418ba7440a4d385cc482d2dabb5bef9794ed17ea7348b213","nodes":[{"id":"sha256-b9f0b8007745e0df7f8e722e06d64364ae01800367a71c8604deeae48e5e7b0a"},{"id":"sha256-ca9862ca023562276ebeeaf7b94f0c57215b461943ad3ed5e068943b417e17f8"}],"provenance":{"producer":"knolo-ceg-compiler/source-v1"},"relations":[{"from":"sha256-ca9862ca023562276ebeeaf7b94f0c57215b461943ad3ed5e068943b417e17f8","id":"sha256-21469b82e313cfb961843e16de68a9c983c9fbb1d84dfffcd146a46152402628","relation":"prohibits","to":"sha256-b9f0b8007745e0df7f8e722e06d64364ae01800367a71c8604deeae48e5e7b0a"},{"from":"sha256-ca9862ca023562276ebeeaf7b94f0c57215b461943ad3ed5e068943b417e17f8","id":"sha256-fab75bdfcfbd063d1b7e6fd7d801b771fa04228977b7f3378cf67773d66a3a27","relation":"permits","to":"sha256-b9f0b8007745e0df7f8e722e06d64364ae01800367a71c8604deeae48e5e7b0a"}],"version":1},"knowledgeRoot":"sha256-aa00ef9317cb8911418ba7440a4d385cc482d2dabb5bef9794ed17ea7348b213","objectRoot":"sha256-0a3036d3aaa3630d76c14072b9d8f7644388f9743f7cbbf51f479c0c0ef8caf7","stateRoot":"sha256-670e83a3010083b170ec0a71d71683d0020d474af3b57616f17dacbe0fa259b0","version":1}
