{"commitDigest":"sha256-4efc23932c16a26985c30ada37eba2abb403defe366dad96af6e45df14163486","graph":{"bindings":[{"evidenceId":"sha256-3ddced14d95d425c9f4ce17156d94e08689e44484a32671e4fd230047fd8899e","id":"sha256-37b2cc12c7a0de77332797b4548a58fee941c05ba3be82a35a180df1c47240b0","nodeId":"sha256-89b7ebc138b8beeaa8522f3bcbb7297341edc8f4b16b169443e46d0e94bee5bc","requirements":["termination-barred"]},{"evidenceId":"sha256-3302b3311f79a894ca669a9d88ff8db6c6b1d5afbfc36e1c738aa1b0bd71649f","id":"sha256-4eef36c6029da7a9a83598696a8590dc7511e37b5fdd068c5abe1f31350c546b","nodeId":"sha256-89b7ebc138b8beeaa8522f3bcbb7297341edc8f4b16b169443e46d0e94bee5bc","requirements":["termination-right"]},{"evidenceId":"sha256-2afc51db28eee5001a20a88335fa6fcf91146701c05583c9ad340b8490382730","id":"sha256-b749208e7e77ed690d6317bf0d140a42a78a67e789a65a7527fa7b8a53eaa93d","nodeId":"sha256-bbef78dc92b654c5ed1db1aba67f60f12b7438eb28d552232b9256cce52e3f94","requirements":["stated-exception"]}],"knowledgeRoot":"sha256-feeae09ec3cdf4bb297e0fedbf2ff03a1030cd5052351cb7c84973fc5d5a8349","nodes":[{"id":"sha256-89b7ebc138b8beeaa8522f3bcbb7297341edc8f4b16b169443e46d0e94bee5bc"},{"id":"sha256-a949a9890b5ea2760cdffc727e911309e209216440ec99ade985fecd0aa9084f"},{"id":"sha256-bbef78dc92b654c5ed1db1aba67f60f12b7438eb28d552232b9256cce52e3f94"}],"provenance":{"producer":"knolo-ceg-compiler/source-v1"},"relations":[{"from":"sha256-a949a9890b5ea2760cdffc727e911309e209216440ec99ade985fecd0aa9084f","id":"sha256-0ebb430f296b44ae4aedcf981d9501784bd354775ecf12b5d83264401c833c4e","relation":"permits","to":"sha256-89b7ebc138b8beeaa8522f3bcbb7297341edc8f4b16b169443e46d0e94bee5bc"},{"from":"sha256-a949a9890b5ea2760cdffc727e911309e209216440ec99ade985fecd0aa9084f","id":"sha256-20827b99ec57910bfa39dedafb8037a6d7382a69dcf1dbda07da1b57d256aa1e","relation":"qualifies","to":"sha256-bbef78dc92b654c5ed1db1aba67f60f12b7438eb28d552232b9256cce52e3f94"},{"from":"sha256-a949a9890b5ea2760cdffc727e911309e209216440ec99ade985fecd0aa9084f","id":"sha256-c02141737def5c365ff3054139f35d663eb6bd61cefd6d1a7e948ff0976b97fb","relation":"prohibits","to":"sha256-89b7ebc138b8beeaa8522f3bcbb7297341edc8f4b16b169443e46d0e94bee5bc"}],"version":1},"knowledgeRoot":"sha256-feeae09ec3cdf4bb297e0fedbf2ff03a1030cd5052351cb7c84973fc5d5a8349","objectRoot":"sha256-d10e0ae7ee0b0f574322380afe8865093a54103df42c80999985e4b23984f673","stateRoot":"sha256-5d503a0056bb4c159d834f86b4654c24beaefee12a9e286db1cbe561a7647df1","version":1}
