{"commitDigest":"sha256-8244f49b80283db1fc066daa5074bc151e2a8475acf97b1978e101bc1085a8f7","graph":{"bindings":[{"evidenceId":"sha256-0e7c0fed13b133cae38567177029378f8a1f14031d8e174af502d68b483f8d4c","id":"sha256-2965c6e9f796ce5fae2c0c365b6fe778c160373d33abd9ccc4d3333cff8b8452","nodeId":"sha256-94bbb007f0c0c56f159f58f95433202b82653378427c81d1317dad5a6aa0330a","requirements":["close-valve"]}],"knowledgeRoot":"sha256-552234a126fd4adc7899ea471739ad218d351c0ea143d689a7a944a0f8fbdc5e","nodes":[{"id":"sha256-94bbb007f0c0c56f159f58f95433202b82653378427c81d1317dad5a6aa0330a"},{"id":"sha256-e3710b57553a6b7f4a5ba181a3d59316951405dff44df24d1617fdf7c1a7fa28"}],"provenance":{"producer":"knolo-ceg-compiler/source-v1"},"relations":[{"from":"sha256-e3710b57553a6b7f4a5ba181a3d59316951405dff44df24d1617fdf7c1a7fa28","id":"sha256-ce6315fe62f83ed188e5fa423d26972f61426d7695eec60286dc9d21b4e87308","relation":"requires","to":"sha256-94bbb007f0c0c56f159f58f95433202b82653378427c81d1317dad5a6aa0330a"}],"version":1},"knowledgeRoot":"sha256-552234a126fd4adc7899ea471739ad218d351c0ea143d689a7a944a0f8fbdc5e","objectRoot":"sha256-64653d693383c272cbbc0368b8bdae7c7c946051af46ee0ff3968e6c5512399a","stateRoot":"sha256-75c995d71528d14f5efd801ec81cd789f19be92056e6a7cdf0fc6abb081f538f","version":1}
