{"commitDigest":"sha256-5629b9410b4328f061686f97120de562e2451a4af99c33c247263514d261acf5","graph":{"bindings":[{"authority":80,"evidenceId":"sha256-7de35ff8030c05ebcdd4892b024b68253cf1d6e563ca242fdf7c360d6d119869","id":"sha256-12d4757191daa594db0c4537b5a474cd4cbd17578adb36497ca7a6132c403284","nodeId":"sha256-b9f0b8007745e0df7f8e722e06d64364ae01800367a71c8604deeae48e5e7b0a","requirements":["cancel-barred"],"validFrom":"2026-01-01"},{"authority":40,"evidenceId":"sha256-0410b9c02eb7fe64b97194cadc3b81f79e7df2ea1d067116e436f69197bc189f","id":"sha256-b8ac99802e0d88f69650e75f6599a7b411c8ac4b4cceea4279007d609f4d2e9a","nodeId":"sha256-b9f0b8007745e0df7f8e722e06d64364ae01800367a71c8604deeae48e5e7b0a","requirements":["cancel-allowed"]}],"knowledgeRoot":"sha256-efe0a65f56a70b21fcd29fdd35335fdb96c60e9a4aea187270726c5888e3cfff","nodes":[{"id":"sha256-b9f0b8007745e0df7f8e722e06d64364ae01800367a71c8604deeae48e5e7b0a"},{"id":"sha256-ca9862ca023562276ebeeaf7b94f0c57215b461943ad3ed5e068943b417e17f8"}],"provenance":{"producer":"knolo-ceg-compiler/source-v1"},"relations":[{"from":"sha256-ca9862ca023562276ebeeaf7b94f0c57215b461943ad3ed5e068943b417e17f8","id":"sha256-21469b82e313cfb961843e16de68a9c983c9fbb1d84dfffcd146a46152402628","relation":"prohibits","to":"sha256-b9f0b8007745e0df7f8e722e06d64364ae01800367a71c8604deeae48e5e7b0a"},{"from":"sha256-ca9862ca023562276ebeeaf7b94f0c57215b461943ad3ed5e068943b417e17f8","id":"sha256-fab75bdfcfbd063d1b7e6fd7d801b771fa04228977b7f3378cf67773d66a3a27","relation":"permits","to":"sha256-b9f0b8007745e0df7f8e722e06d64364ae01800367a71c8604deeae48e5e7b0a"}],"version":1},"knowledgeRoot":"sha256-efe0a65f56a70b21fcd29fdd35335fdb96c60e9a4aea187270726c5888e3cfff","objectRoot":"sha256-23f17200b5af88f6a537f031640d6abe82db2ae52636f2c72bc7959bb9fc5075","stateRoot":"sha256-976e336a7a8f8fb23ceb3642bc0acb8833bdc485fa64502bb54b1371b2269d3e","version":1}
