{"commitDigest":"sha256-abc0dff874ad2bc6eed8426a8976324118d40c20760db32b5f3951365ac9d529","graph":{"bindings":[{"evidenceId":"sha256-a1f5e158d8aa2575a255cc30893715875dc676804f31e4ed02bfad1d4fb14e5b","id":"sha256-36840c24dabaa3ae9c07689d2dd82603eb07b4d96990b24cc3d1c8ead24d0133","nodeId":"sha256-ba7983a7af814d40e1336459b62d60150375b4dbcf0ddacd1ae1531a87ca1555","requirements":["cancel-barred"]},{"evidenceId":"sha256-11d7370d503b329efad8633f8f4e04e30fdd173814af379a3752aab615e0a0ca","id":"sha256-9e4d809a7e56a798ce540fede439888003d7a568b393b79b0195fa0dab34f54a","nodeId":"sha256-ae3d664a4f51ee3303d6714344f93b201c120c31d0c4ac543ada6339c62b1369","requirements":["cancel-allowed"]}],"knowledgeRoot":"sha256-35e5cd0b1e08472b38bafffd79b7dfd00db508cc129eb426cd6ba932a9a99a27","nodes":[{"id":"sha256-ae3d664a4f51ee3303d6714344f93b201c120c31d0c4ac543ada6339c62b1369"},{"id":"sha256-ba7983a7af814d40e1336459b62d60150375b4dbcf0ddacd1ae1531a87ca1555"},{"id":"sha256-ca9862ca023562276ebeeaf7b94f0c57215b461943ad3ed5e068943b417e17f8"}],"provenance":{"producer":"knolo-ceg-compiler/source-v1"},"relations":[{"from":"sha256-ca9862ca023562276ebeeaf7b94f0c57215b461943ad3ed5e068943b417e17f8","id":"sha256-5e1357a0ca9112351b9be42a0202739eb88031a59731ef4e63b8dab366e77f78","relation":"permits","to":"sha256-ae3d664a4f51ee3303d6714344f93b201c120c31d0c4ac543ada6339c62b1369"},{"from":"sha256-ca9862ca023562276ebeeaf7b94f0c57215b461943ad3ed5e068943b417e17f8","id":"sha256-f39e7c33acd288ce3d24d1eb7c47311d1c738795aeb99c5745af560d6c3d8bf7","relation":"prohibits","to":"sha256-ba7983a7af814d40e1336459b62d60150375b4dbcf0ddacd1ae1531a87ca1555"}],"version":1},"knowledgeRoot":"sha256-35e5cd0b1e08472b38bafffd79b7dfd00db508cc129eb426cd6ba932a9a99a27","objectRoot":"sha256-a9c3711e7d5a0f9b075d113233ef7b409c7b793122070029aebcaf9c23c63c2c","stateRoot":"sha256-6db4557125f77322e410bbbd4cb4d10d5ebab5f7b38b96dfc886fef84aeb6a77","version":1}
