{"commitDigest":"sha256-77cc5503d9a1084a69d032afc55ba8ff43852f8d00052d87dfd4f58e5378c9d7","graph":{"bindings":[{"evidenceId":"sha256-0e7c0fed13b133cae38567177029378f8a1f14031d8e174af502d68b483f8d4c","id":"sha256-c4b2a189f6165674a3baae0cab71b86e85333b8223850252f7656acbf656c2dd","nodeId":"sha256-2e44f6183ec2179511aeee72f256b63fca1c4f10f98259ffb11f71aaefb3ef49","requirements":["close-valve"]}],"knowledgeRoot":"sha256-552234a126fd4adc7899ea471739ad218d351c0ea143d689a7a944a0f8fbdc5e","nodes":[{"id":"sha256-2e44f6183ec2179511aeee72f256b63fca1c4f10f98259ffb11f71aaefb3ef49"},{"id":"sha256-e3710b57553a6b7f4a5ba181a3d59316951405dff44df24d1617fdf7c1a7fa28"}],"provenance":{"producer":"knolo-ceg-compiler/source-v1"},"relations":[{"from":"sha256-e3710b57553a6b7f4a5ba181a3d59316951405dff44df24d1617fdf7c1a7fa28","id":"sha256-5ab4582559a5e97bb0567c3252cc01032db3337134657b62c4687648ce0c3e47","relation":"requires","to":"sha256-2e44f6183ec2179511aeee72f256b63fca1c4f10f98259ffb11f71aaefb3ef49"}],"version":1},"knowledgeRoot":"sha256-552234a126fd4adc7899ea471739ad218d351c0ea143d689a7a944a0f8fbdc5e","objectRoot":"sha256-64653d693383c272cbbc0368b8bdae7c7c946051af46ee0ff3968e6c5512399a","stateRoot":"sha256-34d1307fec5d3167618a88c8ac0f11bb1be55c892d68d8aa76eb620d6e7f14eb","version":1}
