{"commitDigest":"sha256-1f5a9b590be4687bd52241c73eaf9b9fc011d4aee4cd5ae2e91a0828aff44c5f","graph":{"bindings":[{"evidenceId":"sha256-e47f8988659c95ab32c0084e19869705ce5c973c94b8a5950b09864e8437d866","id":"sha256-3fb9240e77de165a55ddc87a7ce11617e5300dcfbebe63eabdc5f11379168181","nodeId":"sha256-b9332dd0c0db570eb525affcb184c9567a7e2134d60e7617ae9c859a8e5d477e","requirements":["retain-record"]},{"evidenceId":"sha256-f396af3f537f33e4863edea832a87ff3862816c3b8aa7b720595604e23271de4","id":"sha256-cd6335e380caecbd9f5aa37006b131669b92602e53d47081c8fd748a0d2bcdf9","nodeId":"sha256-bc8fa7e8926d3f6b39820d8b0ee4f3e2c4ce6b0ecc17e8a4b73b3238883272d5","requirements":["litigation-hold"]}],"knowledgeRoot":"sha256-3ecb76c426ccc04b37e1c075952e2aee5e13b09e26b968a452af6897e1fbf441","nodes":[{"id":"sha256-b9332dd0c0db570eb525affcb184c9567a7e2134d60e7617ae9c859a8e5d477e"},{"id":"sha256-bc8fa7e8926d3f6b39820d8b0ee4f3e2c4ce6b0ecc17e8a4b73b3238883272d5"},{"id":"sha256-da7bb9eb13e0ea957be297b61395fb383ea00972b2e2397ad58cf4b3d4f2bd84"}],"provenance":{"producer":"knolo-ceg-compiler/source-v1"},"relations":[{"from":"sha256-da7bb9eb13e0ea957be297b61395fb383ea00972b2e2397ad58cf4b3d4f2bd84","id":"sha256-2022a966d2b9ba813c1498a944f23078ad00b6a4397c23eb5960d4bae26d2158","relation":"requires","to":"sha256-b9332dd0c0db570eb525affcb184c9567a7e2134d60e7617ae9c859a8e5d477e"},{"from":"sha256-da7bb9eb13e0ea957be297b61395fb383ea00972b2e2397ad58cf4b3d4f2bd84","id":"sha256-67120220d782dc1c66de081935da8fa50640cc1e992468ff4fee36510aa88cfc","relation":"excepts","to":"sha256-bc8fa7e8926d3f6b39820d8b0ee4f3e2c4ce6b0ecc17e8a4b73b3238883272d5"}],"version":1},"knowledgeRoot":"sha256-3ecb76c426ccc04b37e1c075952e2aee5e13b09e26b968a452af6897e1fbf441","objectRoot":"sha256-b681a9df7bdb7ded055d78ec9697540ed1a44f36788d2c1acae8d2cde3574e41","stateRoot":"sha256-de49fa114fd739c89cf02a512a53f0c4c62b49843f8f713438b5ba3362c51994","version":1}
