{"version":1,"stateRoot":"sha256-cc7b305433b3985136ead2f5534986f3fbdd54be581db1b842fa8f03ba01e0f6","objectRoot":"sha256-3c426e5cc8b3595bd81f1332176eeb5b8b049994b30d276843f48a8b1d140096","commitDigest":"sha256-74a8693b7fe5f5a9e9ffe66003d0e9de5e526533daa4566761d8c750a78b436d","knowledgeRoot":"sha256-b6db85d43666d3457292d980ddd849a3b489f69258b1d01c17b17512ef098d42","graph":{"version":1,"knowledgeRoot":"sha256-b6db85d43666d3457292d980ddd849a3b489f69258b1d01c17b17512ef098d42","provenance":{"producer":"knolo-ceg-compiler/source-v1"},"nodes":[{"id":"sha256-94bbb007f0c0c56f159f58f95433202b82653378427c81d1317dad5a6aa0330a"},{"id":"sha256-e3710b57553a6b7f4a5ba181a3d59316951405dff44df24d1617fdf7c1a7fa28"}],"relations":[{"id":"sha256-ce6315fe62f83ed188e5fa423d26972f61426d7695eec60286dc9d21b4e87308","from":"sha256-e3710b57553a6b7f4a5ba181a3d59316951405dff44df24d1617fdf7c1a7fa28","relation":"requires","to":"sha256-94bbb007f0c0c56f159f58f95433202b82653378427c81d1317dad5a6aa0330a"}],"bindings":[{"id":"sha256-e62afa0dfeb392de9bb19689f49d62b53c951800289c64dae519f66c174b7308","nodeId":"sha256-94bbb007f0c0c56f159f58f95433202b82653378427c81d1317dad5a6aa0330a","evidenceId":"sha256-ea00eafcea02b92e98eafc73657e19152580e794450724af67535db817abe53b","requirements":["close-valve"]}]}}