{"commitDigest":"sha256-ec822494b19d27f2a7f2aa5798274e1eaf9770e62567d404e5db87a3c8062a3a","graph":{"bindings":[{"evidenceId":"sha256-984ebde48e30411144202327ea6f559e73ab24d68da71274d0e03450e70c5db6","id":"sha256-68137fbf8673e823caf9651d8074f0a9c8cfa2a9e257e56cb5d2a8852a91ff65","nodeId":"sha256-89b7ebc138b8beeaa8522f3bcbb7297341edc8f4b16b169443e46d0e94bee5bc","requirements":["termination-barred"]},{"evidenceId":"sha256-b59bb75956e46aca03aff0bdf011be736af78d0eae11cb6c0eb02ce717e4e0fa","id":"sha256-74ff455e9b118913956d831836341f09a41c341a36e120b6552364dd66273cb4","nodeId":"sha256-bbef78dc92b654c5ed1db1aba67f60f12b7438eb28d552232b9256cce52e3f94","requirements":["stated-exception"]},{"evidenceId":"sha256-b149979573c682752379268bff017727ee2a2410f3e8bd03cf99deb263654b73","id":"sha256-fcbc778b07e86de143e3b44d9a3fdadbdf6d25b99e15666a1fb9764240fe85e5","nodeId":"sha256-89b7ebc138b8beeaa8522f3bcbb7297341edc8f4b16b169443e46d0e94bee5bc","requirements":["termination-right"]}],"knowledgeRoot":"sha256-dea44ff490db9545476d86d69b7e8b28fb943802145534183c342b8a20ba35db","nodes":[{"id":"sha256-89b7ebc138b8beeaa8522f3bcbb7297341edc8f4b16b169443e46d0e94bee5bc"},{"id":"sha256-a949a9890b5ea2760cdffc727e911309e209216440ec99ade985fecd0aa9084f"},{"id":"sha256-bbef78dc92b654c5ed1db1aba67f60f12b7438eb28d552232b9256cce52e3f94"}],"provenance":{"producer":"knolo-ceg-compiler/source-v1"},"relations":[{"from":"sha256-a949a9890b5ea2760cdffc727e911309e209216440ec99ade985fecd0aa9084f","id":"sha256-0ebb430f296b44ae4aedcf981d9501784bd354775ecf12b5d83264401c833c4e","relation":"permits","to":"sha256-89b7ebc138b8beeaa8522f3bcbb7297341edc8f4b16b169443e46d0e94bee5bc"},{"from":"sha256-a949a9890b5ea2760cdffc727e911309e209216440ec99ade985fecd0aa9084f","id":"sha256-20827b99ec57910bfa39dedafb8037a6d7382a69dcf1dbda07da1b57d256aa1e","relation":"qualifies","to":"sha256-bbef78dc92b654c5ed1db1aba67f60f12b7438eb28d552232b9256cce52e3f94"},{"from":"sha256-a949a9890b5ea2760cdffc727e911309e209216440ec99ade985fecd0aa9084f","id":"sha256-c02141737def5c365ff3054139f35d663eb6bd61cefd6d1a7e948ff0976b97fb","relation":"prohibits","to":"sha256-89b7ebc138b8beeaa8522f3bcbb7297341edc8f4b16b169443e46d0e94bee5bc"}],"version":1},"knowledgeRoot":"sha256-dea44ff490db9545476d86d69b7e8b28fb943802145534183c342b8a20ba35db","objectRoot":"sha256-d5b175f17543e873dc310f4f4362cd065efeb1b1ed047a607c7a8a5c665f8c2c","stateRoot":"sha256-c25fc5ac0071f2c12cc0c78efb11bf688b898fb45d558452f1eaaad45eded51e","version":1}
